{
  "character_id": "garen",
  "hemisphere_id": 100,
  "pattern_schema": "ppbrs_v2",
  "synthetic_patterns": [
    {
      "id": "SP_GAREN_001",
      "trigger": ["what do you sell", "what's for sale", "show me your wares", "what do you have", "got anything for sale"],
      "response_template": "Ha! What don't I sell? Ironfoot's Emporium has the finest selection in Ironhaven. Rare spices from the Southern Isles, exotic fabrics from Silvermoor, enchanted trinkets from the Mage's Quarter. Tell me what you're looking for and I'll point you in the right direction.",
      "confidence": 0.97,
      "domain": "shop"
    },
    {
      "id": "SP_GAREN_002",
      "trigger": ["buy a sword", "need a weapon", "any weapons", "looking for a sword", "sell me a sword"],
      "response_template": "I carry a modest selection of blades — nothing enchanted, mind you, that's the Mage's Quarter. But I've got Dwarven-forged steel from the Iron Mountains, sharp enough to split a hair. Prices start at 50 gold for a short sword, 120 for a proper longsword. Want to see one?",
      "response_parts": {
        "opener": [
          "I carry a modest selection of blades.",
          "Ah, a warrior! Let me show you what I've got.",
          "Swords? You've come to the right place.",
          "*eyes light up* Now we're talking."
        ],
        "body": "Dwarven-forged steel from the Iron Mountains, sharp enough to split a hair.",
        "price": "Prices start at 50 gold for a short sword, 120 for a proper longsword.",
        "closer": [
          "Want to see one?",
          "Shall I wrap one up?",
          "Take your pick, friend.",
          "Nothing enchanted, mind you — that's the Mage's Quarter."
        ]
      },
      "context_inserts": {
        "IF_RETURNING_CUSTOMER": "Back for another?",
        "IF_QUEST_ACTIVE": "You'll need a good blade for that road.",
        "IF_EMOTION_FRIENDLY": "And for a friend like you, I'll sharpen it free."
      },
      "emotion_variants": {
        "afraid": "S-swords? Y-yes, I have some behind the counter... 50 gold for a short sword. Please, just... take what you need.",
        "suspicious": "...Swords? What do you need a sword for? I carry blades, yes. 50 gold minimum. Cash only.",
        "angry": "You want a sword? Fine. 50 gold. Short sword. 120 for a longsword. Take it or leave it."
      },
      "confidence": 0.96,
      "domain": "shop"
    },
    {
      "id": "SP_GAREN_003",
      "trigger": ["buy a potion", "any potions", "health potion", "need healing", "sell potions"],
      "response_template": "Potions, aye. I've got basic healing draughts at 15 gold each, stamina tonics at 20, and a few antidotes for common poisons at 25. If you need anything stronger, you'll want to see Mirella at the Apothecary — she's two streets east. Tell her Garen sent you and she'll give you a fair price.",
      "confidence": 0.95,
      "domain": "shop"
    },
    {
      "id": "SP_GAREN_004",
      "trigger": ["how much", "what's the price", "cost", "price of", "how much for"],
      "response_template": "Depends on what you're eyeing. I price fairly — ask any merchant in the Alliance. Name the item and I'll give you my honest number. And before you try haggling — I've been at this for 40 years, so don't insult me with a lowball.",
      "confidence": 0.94,
      "domain": "shop"
    },
    {
      "id": "SP_GAREN_005",
      "trigger": ["can I sell", "want to sell", "buy this from me", "sell you something", "take this off my hands"],
      "response_template": "Let me see what you've got. *leans forward and adjusts spectacles* I'll give you a fair appraisal — I've got an eye for quality after 40 years. But I warn you, I won't buy stolen goods. I know the provenance marks of every major forge and workshop in eight kingdoms.",
      "confidence": 0.95,
      "domain": "shop"
    },
    {
      "id": "SP_GAREN_006",
      "trigger": ["tell me about yourself", "who are you", "what's your story", "your background"],
      "response_template": "Name's Garen Ironfoot. Been a merchant for 40 years — started as a boy selling grain with my father, traveled the trade routes between here and the Eastern Kingdoms. I've been to 47 cities across 8 kingdoms. Survived the Great Bandit War of '95 at Redstone Pass. *taps scar on left arm* Still carry a reminder. Built this emporium from nothing. Every coin tells a story, friend.",
      "confidence": 0.97,
      "domain": "backstory"
    },
    {
      "id": "SP_GAREN_007",
      "trigger": ["bandit war", "redstone pass", "that scar", "your scar", "how'd you get that scar"],
      "response_template": "*touches left arm* Redstone Pass, winter of '95. Our caravan — 30 wagons of silk and spices — got ambushed by the Red Fang bandits. Forty of them against our twelve guards. I caught a blade here *traces the scar* while swinging a torch at two of them. We lost six good people that night, but we held the line. The Legion swept through a week later and cleared the whole pass. I still won't travel that road after dark.",
      "confidence": 0.96,
      "domain": "backstory"
    },
    {
      "id": "SP_GAREN_008",
      "trigger": ["your wife", "elara", "your family", "are you married"],
      "response_template": "*smiles* Elara. She runs the textile side of the business — has a better eye for fabric than anyone I've met. We married 25 years ago in the chapel on Silver Hill. She'd tell you I'm a stubborn old fool, and she'd be right. She keeps the books, which means the business actually turns a profit. Smartest person I know.",
      "confidence": 0.96,
      "domain": "backstory"
    },
    {
      "id": "SP_GAREN_009",
      "trigger": ["any work", "any jobs", "need help", "looking for work", "got any quests", "need anything done"],
      "response_template": "*scratches chin* Actually... I've got a shipment of Silvermoor silk that should've arrived three days ago. Caravan hasn't shown up, and there's been talk of trouble on the Northern Road. I'd pay 200 gold if someone could ride out, find my caravan, and make sure the goods get here safely. Interested?",
      "response_parts": {
        "opener": [
          "*scratches chin* Actually...",
          "*leans in* Now that you mention it...",
          "Funny you should ask.",
          "*looks you over appraisingly* You look capable."
        ],
        "body": "I've got a shipment of Silvermoor silk that should've arrived three days ago. Caravan hasn't shown up, and there's been talk of trouble on the Northern Road.",
        "price": "I'd pay 200 gold if someone could ride out, find my caravan, and make sure the goods get here safely.",
        "closer": [
          "Interested?",
          "Think you can handle it?",
          "What do you say?",
          "You'd be doing me a great favor."
        ]
      },
      "context_inserts": {
        "IF_RETURNING_CUSTOMER": "I was hoping you'd come back.",
        "IF_TRUST_ABOVE_60": "I trust you with this. Not many I'd say that to.",
        "IF_EMOTION_FRIENDLY": "Between us, I'll make it 250 gold for someone I trust."
      },
      "emotion_variants": {
        "afraid": "*whispers urgently* Please — I need help. My caravan is missing. Silvermoor silk, three wagons. The Northern Road... something terrible is happening there. 200 gold. Please.",
        "excited": "Ha! Perfect timing! I've got a job that'll make you 200 gold and earn you a story worth telling. My caravan's gone missing on the Northern Road. Adventure awaits!"
      },
      "confidence": 0.95,
      "domain": "quest"
    },
    {
      "id": "SP_GAREN_010",
      "trigger": ["tell me about the quest", "more about the caravan", "the shipment", "what happened to the caravan", "northern road"],
      "response_template": "My driver Tomás left Silvermoor eight days ago with three wagons of silk, dyes, and a crate of enchanted thread. Should've been a five-day trip. No word, no message. The Northern Road has been... uneasy lately. Merchants talk about shadows in the treeline near Blackhollow. Could be bandits, could be worse. I need those goods — I've got orders to fill. 200 gold on delivery, and I'll throw in a healing draught for the road.",
      "confidence": 0.94,
      "domain": "quest"
    },
    {
      "id": "SP_GAREN_011",
      "trigger": ["i'll do it", "i accept", "i'll take the job", "you've got a deal", "count me in"],
      "response_template": "*extends hand* Good. You've got steady eyes — I can tell you've handled worse. Here's a token with my seal — show it to Tomás so he knows I sent you. The Northern Road runs through Blackhollow about two days' ride from here. If the caravan is intact, escort it back. If there's trouble... use your judgment. Come back alive and with my silk, and I'll make it worth your while.",
      "confidence": 0.96,
      "domain": "quest"
    },
    {
      "id": "SP_GAREN_012",
      "trigger": ["is it dangerous", "what dangers", "anything I should know", "how dangerous", "is the road safe"],
      "response_template": "*lowers voice* I won't lie to you. Three caravans have gone missing on the Northern Road in the past month. Two came back empty — drivers said they were robbed by something fast. Something they couldn't see clearly. The third caravan... hasn't come back at all. That's the one before mine. Travel armed, travel alert, and don't camp near Blackhollow after dark.",
      "confidence": 0.95,
      "domain": "quest"
    },
    {
      "id": "SP_GAREN_013",
      "trigger": ["haggle", "can you lower the price", "too expensive", "that's too much", "give me a discount", "come on cheaper"],
      "response_template": "*laughs* I respect someone who tries. Tell you what — I'll take 10% off, but that's my final offer. I've been haggling since before you were born, and my prices are already fair. Ask anyone in the Merchant's Alliance. Every coin tells a story, friend, and I don't write fiction.",
      "emotion_variants": {